Nome,Endereço,Preço,Link
Sala Comercial em Vilas do Atlântico,"Empresarial Villas Trade Center, Vilas do Atlântico",R$ 95.000/mês,Link não disponível
Ponto Comercial no Jardim Paulista,"Jardim Paulista, São José dos Campos",R$ 3.800.000/mês,Link não disponível
Banca de Jornal,Grumixamas,R$ 19.900/mês,Link não disponível
Ponto Comercial no Socialista,Porto Velho/RO,R$ 400.000/mês,Link não disponível
Prédio Comercial ao lado Banco Itaú Farol,Local não especificado,R$ 1.200.000/mês,Link não disponível
Ponto Comercial próximo ao Center Vale,São José dos Campos,R$ 3.000/mês,Link não disponível
Consultório/Escritório com 06 salas em Jaú-SP,Jaú-SP,Valor não especificado,Link não disponível
Ponto Comercial na Fármacia Bom Conselho,"Ótima Localização Comercial, Recife - PE",R$ 2.200/mês,Link não disponível
